<?xml version="1.0" encoding="UTF-8"?>
<region id="1" regiontype="TT" xmlns:xsi="http://www.w3.org/2001/XMLSchema-instance" xsi:noNamespaceSchemaLocation="../XML-schemas/diplomatic.xsd">
    <rendition type="center underline">CLI</rendition>.<lb/><lb/>
    <rendition type="underline">Examen modi Renaldiniani inscribendi q&#780;vis polygona regularia in circulo,<lb/>
        depromti ex Lib. II. de Resol. &#38; Composi: Mathem: p. 367.</rendition> (<rendition type="underline">vid. Sturmii<lb/>
            Mathesin enucleatam p. 38.</rendition>)
</region>
